Number,Question,Type,Answer,WrongAnswers,Passage,Points,Topic
433,What are the two ordinances of the Church?,MultipleChoice,Water baptism and communion,Worship and prayer|Eating and sleeping|Reading the Bible and prayer|Preaching and teaching,,20,Millennium
434,"What is symbolized, or pictured, by water baptism?",Jumble,The death of the old sinful nature and a new life in Christ,,Romans 6:4-6,20,Millennium
435,Who should be baptized in water?,Jumble,Every person who believes in Jesus [Christ] as Savior,,Acts 2:41,20,Millennium
436,What is the proper method of water baptism?,MultipleChoice,Immersion in water,Dipping a toe in water|Avoiding water|Shower in water|Hands in water,Acts 8:38,20,Millennium
437,In whose name should Christians be baptized?,Jumble,"In the name of the Father, and the Son, and the Holy Spirit",,Matthew 28:19,20,Millennium
438,"In communion, what is symbolized by the bread and the cup?",Jumble,"The bread represents the body of Jesus, and the cup represents His blood which He shed for our sins.",,"1 Corinthians 11:24,25",20,Millennium
439,Quote the verse from First Corinthians in which Paul explains the purpose of the Lord's Supper?,Jumble,"For every time you eat this bread and drink this cup, you are announcing the Lord's death until he comes again.",,1 Corinthians 11:26,20,Millennium
440,"At the communion service, who is to judge who is worthy to partake?",MultipleChoice,Everyone should examine themselves,Only the elderly|Only those baptized|Only those who read the Bible|Only the church leaders,1 Corinthians 11:28,20,Millennium
441,How did death come into the world?,MultipleChoice,Death first came as a result of willful sin,Death came on its own|Death came in the night|Death was created by the devil|Death came at creation,Romans 5:12; 8:18-23,20,Millennium
442,What prophecy did Isaiah make concerning Jesus' power to heal?,Jumble,He took our sicknesses and removed our diseases.,,"Isaiah 53:4,5; Matthew 8:17",20,Millennium
443,What was the purpose of Jesus' miracles?,Jumble,They showed God the Father's endorsement [approval] of Him.,,Acts 2:22,20,Millennium
444,What is a great lesson from the Book of Job?,Jumble,Not all misfortune which comes to a believer is punishment for sin.,,,20,Millennium
445,What does James instruct us to do if we are sick?,Jumble,We should ask the elders [ministers] to anoint us with oil and pray for God to heal us.,,James 5:14-16,20,Millennium
446,What is the Christian's blessed hope?,Jumble,The return of Jesus [Christ],,Titus 2:13,20,Millennium
447,What is the Rapture?,Jumble,When Jesus [Christ] returns to take His Church--the believers both dead and living--out of this world,,1 Thessalonians 4:16,20,Millennium
448,Who knows when the Rapture will occur?,MultipleChoice,Only God the Father,The saved|All people|The church leaders|Nobody,Matthew 24:36,20,Millennium
449,Why should the coming of Jesus not surprise the Christians?,Jumble,Because Christians do not live in the darkness,,1 Thessalonians 5:4,20,Millennium
450,What two events will happen in heaven shortly after the Rapture?,Jumble,The judgment of Christians and the wedding feast of the Lamb,,2 Corinthians 5:10; Revelation 19:7-9,20,Millennium
451,What is the Great Tribulation?,Jumble,The Great Tribulation is a period of extreme trouble and turmoil before the final judgment.,,Matthew 24:21,20,Millennium
452,What do we mean when we speak of the Antichrist?,Jumble,The man who will rule the world during the Great Tribulation and will attempt to make all people worship him as God,,"2 Thessalonians 2:3,4",20,Millennium
453,What is the Millennium?,Jumble,A future period of one thousand years when Jesus [Christ] shall rule over the earth,,Revelation 20:4,20,Millennium
454,What will happen to Satan during the Millennium?,Jumble,He will be imprisoned in a bottomless pit so that he cannot tempt people.,,Revelation 20:1-3,20,Millennium
455,What will happen at the conclusion of the Millennium?,Jumble,"Satan will be loosed from the bottomless pit, and Christ [Jesus] will completely conquer him and his followers.",,"Revelation 20:1-3,7-10",20,Millennium
456,What two appointments will all people keep?,MultipleChoice,Death and judgment,Death and taxes|The dentist and doctor|Prayer and baptism|Eating and sleeping,Hebrews 9:27,20,Millennium
457,What is heaven?,Jumble,Heaven is the place of eternal joy which God is preparing for those who love Him and accept Jesus [Christ] as their Savior.,,Matthew 25:34,20,Millennium
458,What is done by everyone who looks for Christ's appearing?,Jumble,They keep themselves pure.,,"1 John 3:2,3",20,Millennium
459,Who will spend eternity in heaven?,Jumble,Those who accept Christ [Jesus] as Savior and whose names are written in the Lamb's Book of Life,,Revelation 21:27,20,Millennium
460,Name five things that will not be found in heaven?,MultipleChoice,"Tears, death, sorrow, pain, evil","Coffee, tea, sugar, candy, soda|Star Trek 1, Star Trek 2, Star Trek 3, Star Trek 4, Star Trek 5|Basketball, Football, Soccer, Tennis, Curling|Depression, Self-doubt, Anxiety, Earaches, Pimples|Star Wars 1, Star Wars 2, Star Wars 3, Star Wars 4, Star Wars 5","Revelation 21:4,27",20,Millennium
461,What is the last enemy to be destroyed?,MultipleChoice,Death,Satan|Sickness|Evil|Hunger,"1 Corinthians 15:25,26",20,Millennium
462,What is hell?,Jumble,"A place of eternal fire, punishment and torment",,Mark 9:43-48; Luke 16:23,20,Millennium
463,For whom did God prepare hell?,Jumble,The devil and his demons,,Matthew 25:41,20,Millennium
464,Who will spend eternity in the lake of fire?,Jumble,All who refuse Christ [Jesus] as Savior and whose names are not written in the Lamb's Book of Life,,Revelation 20:15,20,Millennium
465,Where did the devil come from?,Jumble,The devil [Satan] was an angel whom God had to punish for trying to make himself greater than God.,,Isaiah 14:12-15; Ezekiel 28:11-18,20,Millennium
466,Why is the devil not as powerful as God?,Jumble,The devil was created by God and has been defeated by Jesus' death and resurrection.,,John 16:11; Colossians 1:16,20,Millennium
467,Why can't evil powers control a Christian?,Jumble,Because the [Holy] Spirit who lives in you is greater than the spirit who lives in the world,,1 John 4:4,20,Millennium
468,"What should a Christian's attitude be toward spiritism, astrology, and other occult practices?",Jumble,Christians should avoid all occult practices because Scripture specifically forbids them.,,Isaiah 47:12-15,20,Millennium
469,What happens to a Christian's soul and spirit at death?,Jumble,The Christian's soul and spirit go immediately to be with the Lord.,,2 Corinthians 5:8,20,Millennium
470,What story of Jesus indicates that both the righteous and wicked are conscious after death?,Jumble,The story of Lazarus and the rich man,,Luke 16:19-31,20,Millennium
471,What confession of faith in eternal life and resurrection did Job make?,Jumble,Job declared that even though he would die and his body decay he would be resurrected and see God.,,"Job 19:25,26",20,Millennium
472,Who will be resurrected?,Jumble,Both the righteous and the wicked--the righteous to receive eternal life and the wicked to receive eternal punishment,,"John 5:28,29",20,Millennium
473,"Which chapter of the Bible is known as the ""resurrection chapter""?",MultipleChoice,1 Corinthians 15,John 11|1 Corinthians 15|Philippians 3|Isaiah 5,,20,Millennium
474,"In First Corinthians chapter 15, what illustration does Paul use to explain the resurrection of Christians?",Jumble,The sprouting of a new plant from a seed,,1 Corinthians 15:36-44,20,Millennium
475,There are over how many references in the New Testament to the second coming of Christ?,MultipleChoice,[Over] 300,"[Over] 10,00|[Under] 12|Exactly 30|Zero",,20,Millennium
476,When will Christians who have died be resurrected?,Jumble,At the rapture of the Church,,"1 Thessalonians 4:16,17",20,Millennium
477,Jesus said that the age or time of His return will be like the days of whom?,MultipleChoice,Noah and Lot,Noah and Moses|John and Peter|Elisha and Elijah|Bob and Billy,Luke 17:26-28,20,Millennium
478,"What do we mean when we speak of the ""Revelation"" of Christ?",Jumble,His return to earth to rule and reign for one thousand years following the Great Tribulation,,2 Thessalonians 2:8; Revelation 20:4-6,20,Millennium
479,What two great events comprise the second coming of Christ?,Jumble,The Rapture and Christ's revelation,,"1 Thessalonians 4:16,17; 2 Thessalonians 2:8",20,Millennium
480,Which of Jesus' parables tells us that some who claim to be Christians will be unprepared for His return?,Jumble,The Parable of the Five Wise and Five Foolish Bridesmaids,,Matthew 25:1-13,20,Millennium
